{
  "catalogue": "49GAION Reference-Model Catalogue",
  "version": "v0.1.0",
  "status": "draft",
  "rules": [
    "A pattern is a method. It may suggest a structure; it never states a fact about an organisation.",
    "Every element a pattern suggests still needs the organisation's own evidence. Without it, the element is an assumption, with what breaks if it is false.",
    "A pattern never raises the label of a statement, never closes an unknown and never settles a contradiction.",
    "A pattern names role-types only: never a person or a position.",
    "This catalogue holds no organisation's data and no copied text. Each pattern is a plain description of a widely known way to organise."
  ],
  "patterns": [
    {
      "pattern_id": "RMP-FUNCTIONAL",
      "name": "Functional organisation",
      "summary": "Work is grouped by kind of expertise, such as sales, operations, finance and people. Each function has one accountable lead, and the top role joins the functions together.",
      "typical_capabilities": [
        "Direction and governance",
        "Sales and customer relations",
        "Operations or delivery",
        "Finance",
        "People",
        "Support services, such as legal, premises and information"
      ],
      "decision_rights": [
        {
          "decision": "Overall direction and priorities",
          "role_type": "the top role"
        },
        {
          "decision": "The budget across functions",
          "role_type": "the top role, advised by the finance lead"
        },
        {
          "decision": "Methods and standards inside a function",
          "role_type": "the function lead"
        },
        {
          "decision": "Hiring inside an approved budget",
          "role_type": "the function lead"
        }
      ],
      "typical_hand_offs": [
        {
          "from": "sales",
          "to": "operations",
          "what_crosses": "a confirmed order or commitment to deliver"
        },
        {
          "from": "operations",
          "to": "finance",
          "what_crosses": "delivery records for billing"
        },
        {
          "from": "every function",
          "to": "finance",
          "what_crosses": "spending requests inside the budget"
        },
        {
          "from": "people",
          "to": "every function",
          "what_crosses": "newly filled positions ready to work"
        }
      ],
      "fits_when": [
        "There is one main line of products or services.",
        "The organisation serves one market or a few similar ones.",
        "Depth of expertise matters more than speed across functions."
      ],
      "does_not_fit_when": [
        "There are several distinct product lines or markets that need their own priorities.",
        "Most work needs fast coordination across many functions every day."
      ],
      "known_risks": [
        "Each function serves its own goals before the whole.",
        "Decisions that cross functions are slow and pile up at the top role.",
        "No one owns a customer's whole experience."
      ],
      "never_evidence": "This pattern is never evidence for an organisation."
    },
    {
      "pattern_id": "RMP-DIVISIONAL",
      "name": "Divisional organisation",
      "summary": "The organisation is split into divisions by product, market, customer group or region. Each division holds most of the functions it needs and answers for its own results, under a small centre.",
      "typical_capabilities": [
        "Direction of the whole and allocation of capital, at the centre",
        "Rules for the whole, such as financial reporting, risk and legal, set at the centre",
        "In each division: its sales, its delivery and its management",
        "Review of each division's results"
      ],
      "decision_rights": [
        {
          "decision": "The strategy of the whole, and capital between divisions",
          "role_type": "the top role at the centre"
        },
        {
          "decision": "A division's plan and operations, inside its targets",
          "role_type": "the division lead"
        },
        {
          "decision": "Policies that bind every division, such as finance, risk and legal",
          "role_type": "the centre's function leads"
        },
        {
          "decision": "Prices and offers inside a division",
          "role_type": "the division lead"
        }
      ],
      "typical_hand_offs": [
        {
          "from": "the centre",
          "to": "a division",
          "what_crosses": "targets, capital and the policies that bind it"
        },
        {
          "from": "a division",
          "to": "the centre",
          "what_crosses": "results and forecasts"
        },
        {
          "from": "a division",
          "to": "another division",
          "what_crosses": "shared customers or internal supply, on agreed terms"
        }
      ],
      "fits_when": [
        "Products, markets or regions differ enough to need their own priorities.",
        "Each division is large enough to carry its own functions.",
        "Results can be measured division by division."
      ],
      "does_not_fit_when": [
        "The organisation is too small to repeat functions in each division.",
        "The products share most of their customers and their ways of working."
      ],
      "known_risks": [
        "Functions are repeated in every division, at a cost.",
        "Divisions compete for customers or resources.",
        "The centre loses sight of risks that cross divisions.",
        "Practices drift apart between divisions."
      ],
      "never_evidence": "This pattern is never evidence for an organisation."
    },
    {
      "pattern_id": "RMP-MATRIX",
      "name": "Matrix organisation",
      "summary": "Two lines of accountability cross: one by function or expertise, one by product, project, market or region. Many roles answer to both, so the decision rights must say which line decides what.",
      "typical_capabilities": [
        "Function leadership: standards, expertise and people",
        "Product, project or market leadership: priorities and results",
        "Joint planning of the time of positions shared by the two lines",
        "Settling conflicts between the two lines"
      ],
      "decision_rights": [
        {
          "decision": "What is delivered, and when",
          "role_type": "the product, project or market lead"
        },
        {
          "decision": "How the work is done, and its quality standards",
          "role_type": "the function lead"
        },
        {
          "decision": "How the time of shared positions is split",
          "role_type": "the two leads jointly, under a rule agreed in advance"
        },
        {
          "decision": "A conflict the two lines cannot settle",
          "role_type": "a named role above both lines"
        }
      ],
      "typical_hand_offs": [
        {
          "from": "a function",
          "to": "a product, project or market",
          "what_crosses": "positions and expertise assigned"
        },
        {
          "from": "a product, project or market",
          "to": "a function",
          "what_crosses": "demand and priorities"
        },
        {
          "from": "both lines",
          "to": "the role above both",
          "what_crosses": "conflicts they could not settle"
        }
      ],
      "fits_when": [
        "The work needs both deep expertise and a strong focus on products, projects or markets.",
        "Scarce experts must be shared.",
        "The organisation can afford the effort of coordination."
      ],
      "does_not_fit_when": [
        "The decision rights of the two lines cannot be written down clearly.",
        "The organisation is small, and a second line adds effort without benefit."
      ],
      "known_risks": [
        "Accountability becomes unclear.",
        "Decisions slow down, and the two lines come into conflict.",
        "Coordination takes a large share of everyone's time.",
        "People are caught between two leads."
      ],
      "never_evidence": "This pattern is never evidence for an organisation."
    },
    {
      "pattern_id": "RMP-SHARED-SERVICE",
      "name": "Shared-service centre",
      "summary": "Common support work, such as finance processing, people administration, purchasing or information services, is done once, in one centre, for several units, under agreed service terms.",
      "typical_capabilities": [
        "Delivery of the shared services to the units served",
        "Service terms and demand",
        "Reporting on service against its terms",
        "Improvement of the shared ways of working"
      ],
      "decision_rights": [
        {
          "decision": "Which services are shared, and their scope",
          "role_type": "the role with authority over all the units served, or, between independent entities, their agreement"
        },
        {
          "decision": "Service terms: levels, charges and priorities",
          "role_type": "the centre lead and the units served, agreed under that authority"
        },
        {
          "decision": "How a service is delivered",
          "role_type": "the centre lead"
        },
        {
          "decision": "Whether a unit may leave a shared service",
          "role_type": "the same authority that decided the service is shared"
        }
      ],
      "typical_hand_offs": [
        {
          "from": "a unit",
          "to": "the centre",
          "what_crosses": "requests, and the information the service needs"
        },
        {
          "from": "the centre",
          "to": "a unit",
          "what_crosses": "the completed service and its records"
        },
        {
          "from": "the centre",
          "to": "the deciding authority",
          "what_crosses": "service results against the agreed terms"
        }
      ],
      "fits_when": [